{
  "$schema": "https://json-schema.org/draft/2020-12/schema",
  "$id": "catalog.styles.schema.json",
  "type": "object",
  "additionalProperties": false,
  "required": ["id", "createdAt", "updatedAt", "styles"],
  "properties": {
    "id": { "type": "string", "minLength": 1 },
    "createdAt": { "type": "string", "format": "date-time" },
    "updatedAt": { "type": "string", "format": "date-time" },
    "styles": {
      "type": "array",
      "minItems": 1,
      "items": {
        "type": "object",
        "additionalProperties": false,
        "required": ["id", "label"],
        "properties": {
          "id": { "type": "string", "minLength": 1 },
          "label": { "type": "string", "minLength": 1 },
          "description": { "type": "string" },
          "promptTokens": { "type": "array", "items": { "type": "string" } },
          "aliases": { "type": "array", "items": { "type": "string" } }
        }
      }
    }
  }
}
