{
  "id": "styles",
  "createdAt": "2026-02-03T00:00:00.000Z",
  "updatedAt": "2026-02-03T00:00:00.000Z",
  "styles": [
    {
      "id": "comic",
      "label": "Comic",
      "promptTokens": [
        "comic style",
        "bold outlines",
        "high contrast"
      ]
    },
    {
      "id": "cartoon",
      "label": "Cartoon",
      "promptTokens": [
        "cartoon",
        "clean shapes"
      ]
    },
    {
      "id": "pixel_art",
      "label": "Pixel Art",
      "promptTokens": [
        "pixel art",
        "low-res"
      ]
    },
    {
      "id": "realistic",
      "label": "Realistic",
      "promptTokens": [
        "realistic"
      ]
    }
  ]
}
